{
  "created_at": "2026-09-27T03:06:00Z",
  "inventory": "ml/manifests/uav-sead-774a336a-batch-006-inventory.json",
  "label_provenance": "expert_review",
  "records": [
    {
      "exclusion_reason": null,
      "fault_family": null,
      "flight_id": "flight-031",
      "ranges_ms": [
        {
          "end": 371015.0,
          "source_class": "Mechanical",
          "source_signal": "Actuator Outputs",
          "start": 362181.0
        },
        {
          "end": 482538.0,
          "source_class": "Mechanical",
          "source_signal": "Actuator Outputs",
          "start": 467447.0
        },
        {
          "end": 493212.0,
          "source_class": "Mechanical",
          "source_signal": "Actuator Outputs",
          "start": 487323.0
        },
        {
          "end": 555782.0,
          "source_class": "Altitude",
          "source_signal": "Position.Z",
          "start": 517872.0
        }
      ],
      "sha256": "404b317045e76c0b50cffa3076f6e8c9f9bde5623cbb90fc0e626e2d50997d73",
      "source_classes": [
        "Altitude",
        "Mechanical"
      ],
      "training_eligible": true,
      "window_label": "anomalous"
    },
    {
      "exclusion_reason": null,
      "fault_family": null,
      "flight_id": "flight-032",
      "ranges_ms": [
        {
          "end": 1740786.293,
          "source_class": "External Position",
          "source_signal": "Position.X",
          "start": 1719471.529
        },
        {
          "end": 1727144.846,
          "source_class": "External Position",
          "source_signal": "Position.X",
          "start": 1722881.903
        },
        {
          "end": 1739081.106,
          "source_class": "External Position",
          "source_signal": "Position.Y",
          "start": 1722881.903
        },
        {
          "end": 1815814.275,
          "source_class": "External Position",
          "source_signal": "Velocity",
          "start": 1729702.603
        }
      ],
      "sha256": "6e90910e466663288fddb0fa7f48a1c5be145018652565fc4a986f37e6b888a3",
      "source_classes": [
        "External Position"
      ],
      "training_eligible": true,
      "window_label": "anomalous"
    },
    {
      "exclusion_reason": null,
      "fault_family": null,
      "flight_id": "flight-033",
      "ranges_ms": [
        {
          "end": 68152.78,
          "source_class": "Global Position",
          "source_signal": "Position.X",
          "start": 66617.756
        },
        {
          "end": 70857.346,
          "source_class": "Global Position",
          "source_signal": "Position.X",
          "start": 69322.321
        },
        {
          "end": 82041.093,
          "source_class": "Global Position",
          "source_signal": "Position.X",
          "start": 72538.564
        }
      ],
      "sha256": "342053b82aefb8b0ee518c3c6feb17504912f560c778832448b5f9397fc21da4",
      "source_classes": [
        "Global Position"
      ],
      "training_eligible": true,
      "window_label": "anomalous"
    },
    {
      "exclusion_reason": null,
      "fault_family": null,
      "flight_id": "flight-034",
      "ranges_ms": [],
      "sha256": "954a04d55f8adcce4efda75534a724454359cff5ed00f6a65c7f8f67785077e7",
      "source_classes": [
        "Normal"
      ],
      "training_eligible": true,
      "window_label": "normal"
    },
    {
      "exclusion_reason": null,
      "fault_family": null,
      "flight_id": "flight-035",
      "ranges_ms": [],
      "sha256": "6b7158828142800e4e3a4735c420ccab76d5a38184f3e1c4743a24208771365c",
      "source_classes": [
        "Normal"
      ],
      "training_eligible": true,
      "window_label": "normal"
    }
  ],
  "schema_version": "1.0.0",
  "source_id": "uav-sead",
  "source_version": "774a336a1d1d06b248927a35c2ea1f6869e9e1a4"
}
