{
  "created_at": "2026-09-27T11:34:00Z",
  "inventory": "ml/manifests/uav-sead-774a336a-batch-034-inventory.json",
  "label_provenance": "expert_review",
  "records": [
    {
      "exclusion_reason": null,
      "fault_family": null,
      "flight_id": "flight-171",
      "ranges_ms": [
        {
          "end": 56247.0,
          "source_class": "Altitude",
          "source_signal": "Position.Z",
          "start": 49636.0
        },
        {
          "end": 74244.0,
          "source_class": "Altitude",
          "source_signal": "Position.Z",
          "start": 71398.0
        },
        {
          "end": 88293.0,
          "source_class": "Altitude",
          "source_signal": "Position.Z",
          "start": 83886.0
        },
        {
          "end": 96190.0,
          "source_class": "Altitude",
          "source_signal": "Position.Z",
          "start": 92425.0
        },
        {
          "end": 115472.0,
          "source_class": "Altitude",
          "source_signal": "Position.Z",
          "start": 110789.0
        }
      ],
      "sha256": "edfed22bf2b7dd0e4cb6ea3a092c41cdf111c46dd49462b08baaf54b2be42c2f",
      "source_classes": [
        "Altitude"
      ],
      "training_eligible": true,
      "window_label": "anomalous"
    },
    {
      "exclusion_reason": null,
      "fault_family": null,
      "flight_id": "flight-172",
      "ranges_ms": [
        {
          "end": 36543.0,
          "source_class": "Altitude",
          "source_signal": "Position.Z",
          "start": 34177.0
        },
        {
          "end": 47948.0,
          "source_class": "Altitude",
          "source_signal": "Position.Z",
          "start": 44290.0
        },
        {
          "end": 57630.0,
          "source_class": "Altitude",
          "source_signal": "Position.Z",
          "start": 52843.0
        },
        {
          "end": 84689.0,
          "source_class": "Altitude",
          "source_signal": "Position.Z",
          "start": 79417.0
        }
      ],
      "sha256": "465f99a88f6f681fa4bfda2a917e94fa78fc96306fceb525b72a29cafed99baf",
      "source_classes": [
        "Altitude"
      ],
      "training_eligible": true,
      "window_label": "anomalous"
    },
    {
      "exclusion_reason": null,
      "fault_family": null,
      "flight_id": "flight-173",
      "ranges_ms": [
        {
          "end": 38977.0,
          "source_class": "Altitude",
          "source_signal": "Position.Z",
          "start": 34529.0
        },
        {
          "end": 54836.0,
          "source_class": "Altitude",
          "source_signal": "Position.Z",
          "start": 50775.0
        },
        {
          "end": 60638.0,
          "source_class": "Altitude",
          "source_signal": "Position.Z",
          "start": 57608.0
        },
        {
          "end": 86940.0,
          "source_class": "Altitude",
          "source_signal": "Position.Z",
          "start": 82105.0
        }
      ],
      "sha256": "e785a813c476125caa0d2017579118bb2b741b905b3b1bc415843c3c2930abe0",
      "source_classes": [
        "Altitude"
      ],
      "training_eligible": true,
      "window_label": "anomalous"
    },
    {
      "exclusion_reason": null,
      "fault_family": null,
      "flight_id": "flight-174",
      "ranges_ms": [],
      "sha256": "d81f29c7b1b5b2caa9f2c4badf8c8d05df83eb33dba8dea3832d4cebca3c6ae1",
      "source_classes": [
        "Normal"
      ],
      "training_eligible": true,
      "window_label": "normal"
    },
    {
      "exclusion_reason": null,
      "fault_family": null,
      "flight_id": "flight-175",
      "ranges_ms": [],
      "sha256": "43dd45a103a22fcf7f7de96470d781211779c31bfb13da1fd736522eac0b1c67",
      "source_classes": [
        "Normal"
      ],
      "training_eligible": true,
      "window_label": "normal"
    }
  ],
  "schema_version": "1.0.0",
  "source_id": "uav-sead",
  "source_version": "774a336a1d1d06b248927a35c2ea1f6869e9e1a4"
}
