{
  "created_at": "2026-09-27T06:24:00Z",
  "inventory": "ml/manifests/uav-sead-774a336a-batch-024-inventory.json",
  "label_provenance": "expert_review",
  "records": [
    {
      "exclusion_reason": null,
      "fault_family": null,
      "flight_id": "flight-121",
      "ranges_ms": [
        {
          "end": 72371.0,
          "source_class": "External Position",
          "source_signal": "Position.X",
          "start": 67214.0
        }
      ],
      "sha256": "9582b9c15c1382a99f345315ead1d2471133e54967bed4401a6d2f2b76b1e39c",
      "source_classes": [
        "External Position"
      ],
      "training_eligible": true,
      "window_label": "anomalous"
    },
    {
      "exclusion_reason": null,
      "fault_family": null,
      "flight_id": "flight-122",
      "ranges_ms": [
        {
          "end": 3968032.0,
          "source_class": "Altitude",
          "source_signal": "Position.Z",
          "start": 3965352.0
        }
      ],
      "sha256": "808131d9b2f3c9ed2b16b636b0424fdba2935ca2956efdcb7202eac19953e632",
      "source_classes": [
        "Altitude"
      ],
      "training_eligible": true,
      "window_label": "anomalous"
    },
    {
      "exclusion_reason": null,
      "fault_family": null,
      "flight_id": "flight-123",
      "ranges_ms": [
        {
          "end": 92352.0,
          "source_class": "External Position",
          "source_signal": "Position.X",
          "start": 83983.0
        }
      ],
      "sha256": "b6211ab37c514f2b011f8c4b086c4b468ec6d818612c3a2b0af0c270e4c27516",
      "source_classes": [
        "External Position"
      ],
      "training_eligible": true,
      "window_label": "anomalous"
    },
    {
      "exclusion_reason": null,
      "fault_family": null,
      "flight_id": "flight-124",
      "ranges_ms": [],
      "sha256": "b1c7b4ae3ab4595fe018044d1696733aa7ce50a9dea594a8c1ea1119d18b7874",
      "source_classes": [
        "Normal"
      ],
      "training_eligible": true,
      "window_label": "normal"
    },
    {
      "exclusion_reason": null,
      "fault_family": null,
      "flight_id": "flight-125",
      "ranges_ms": [],
      "sha256": "f50af2f9f5b50f06e6fcd737ae404186b9f13bf9cdec958251a6a6d96ca354f7",
      "source_classes": [
        "Normal"
      ],
      "training_eligible": true,
      "window_label": "normal"
    }
  ],
  "schema_version": "1.0.0",
  "source_id": "uav-sead",
  "source_version": "774a336a1d1d06b248927a35c2ea1f6869e9e1a4"
}
