{
  "created_at": "2026-09-27T06:21:00Z",
  "inventory": "ml/manifests/uav-sead-774a336a-batch-021-inventory.json",
  "label_provenance": "expert_review",
  "records": [
    {
      "exclusion_reason": null,
      "fault_family": null,
      "flight_id": "flight-106",
      "ranges_ms": [
        {
          "end": 204748.502,
          "source_class": "External Position",
          "source_signal": "Position.X",
          "start": 180393.562
        }
      ],
      "sha256": "69f21c56b8f4d4498aec66349429bbaf4c18827e1975795ef6eba839cff39eb8",
      "source_classes": [
        "External Position"
      ],
      "training_eligible": true,
      "window_label": "anomalous"
    },
    {
      "exclusion_reason": null,
      "fault_family": null,
      "flight_id": "flight-107",
      "ranges_ms": [
        {
          "end": 169981.0,
          "source_class": "Altitude",
          "source_signal": "Position.Z",
          "start": 168525.0
        }
      ],
      "sha256": "ede0c04337ffaf1f9b798b7369129f9eb6e813c09750da5b3a8addfb9ba75576",
      "source_classes": [
        "Altitude"
      ],
      "training_eligible": true,
      "window_label": "anomalous"
    },
    {
      "exclusion_reason": null,
      "fault_family": null,
      "flight_id": "flight-108",
      "ranges_ms": [
        {
          "end": 82321.315,
          "source_class": "External Position",
          "source_signal": "Position.X",
          "start": 59181.929
        }
      ],
      "sha256": "fcf55277e3f57827aa4e50ae42cda876589908b8e6c610c8794c88c84b6a3ab1",
      "source_classes": [
        "External Position"
      ],
      "training_eligible": true,
      "window_label": "anomalous"
    },
    {
      "exclusion_reason": null,
      "fault_family": null,
      "flight_id": "flight-109",
      "ranges_ms": [],
      "sha256": "f1ebcc0448ace72324344edb2d119739fb7d119dff784b7e1f64948813f66022",
      "source_classes": [
        "Normal"
      ],
      "training_eligible": true,
      "window_label": "normal"
    },
    {
      "exclusion_reason": null,
      "fault_family": null,
      "flight_id": "flight-110",
      "ranges_ms": [],
      "sha256": "3bfc28a5222fcb9191104164fc5883ea593b3dedeba5896a7981a14f2d18122c",
      "source_classes": [
        "Normal"
      ],
      "training_eligible": true,
      "window_label": "normal"
    }
  ],
  "schema_version": "1.0.0",
  "source_id": "uav-sead",
  "source_version": "774a336a1d1d06b248927a35c2ea1f6869e9e1a4"
}
