{
  "created_at": "2026-09-27T05:18:00Z",
  "inventory": "ml/manifests/uav-sead-774a336a-batch-018-inventory.json",
  "label_provenance": "expert_review",
  "records": [
    {
      "exclusion_reason": null,
      "fault_family": null,
      "flight_id": "flight-091",
      "ranges_ms": [
        {
          "end": 255450.0,
          "source_class": "Mechanical",
          "source_signal": "Actuator Controls",
          "start": 242498.0
        },
        {
          "end": 264032.0,
          "source_class": "Mechanical",
          "source_signal": "Actuator Controls",
          "start": 256074.0
        }
      ],
      "sha256": "2d47a9e091f73bef3c2f328ff750cef0c610aef6e725c501095b5f2d47fea66c",
      "source_classes": [
        "Mechanical"
      ],
      "training_eligible": true,
      "window_label": "anomalous"
    },
    {
      "exclusion_reason": null,
      "fault_family": null,
      "flight_id": "flight-092",
      "ranges_ms": [
        {
          "end": 328649.0,
          "source_class": "Altitude",
          "source_signal": "Position.Z",
          "start": 322562.0
        },
        {
          "end": 375371.0,
          "source_class": "Altitude",
          "source_signal": "Position.Z",
          "start": 356287.0
        }
      ],
      "sha256": "11a01837ccc70ad6f4f91d98409cc25516150c4ad6ef082c3327e083802d95d9",
      "source_classes": [
        "Altitude"
      ],
      "training_eligible": true,
      "window_label": "anomalous"
    },
    {
      "exclusion_reason": null,
      "fault_family": null,
      "flight_id": "flight-093",
      "ranges_ms": [
        {
          "end": 117171.802,
          "source_class": "External Position",
          "source_signal": "Position.X",
          "start": 90187.302
        }
      ],
      "sha256": "c5d205bb6f3c2f704a201faeffc04e8ea0b014ce6952e8ffb4b96ce2102d5776",
      "source_classes": [
        "External Position"
      ],
      "training_eligible": true,
      "window_label": "anomalous"
    },
    {
      "exclusion_reason": null,
      "fault_family": null,
      "flight_id": "flight-094",
      "ranges_ms": [],
      "sha256": "7b39af57b33b33a4fa6fa7e3ac86df925b553b9ce3098252299f0ff29635f876",
      "source_classes": [
        "Normal"
      ],
      "training_eligible": true,
      "window_label": "normal"
    },
    {
      "exclusion_reason": null,
      "fault_family": null,
      "flight_id": "flight-095",
      "ranges_ms": [],
      "sha256": "3142d38f7bcd78291ab421c1e9a74009d906452c30b4cd36b9744d52cd3bf56b",
      "source_classes": [
        "Normal"
      ],
      "training_eligible": true,
      "window_label": "normal"
    }
  ],
  "schema_version": "1.0.0",
  "source_id": "uav-sead",
  "source_version": "774a336a1d1d06b248927a35c2ea1f6869e9e1a4"
}
